[
  {
    "id": "GDPR-Art5.1e",
    "clause_ref": "Article 5(1)(e)",
    "domain": "Data Minimization & Retention",
    "control_objective": "Ensure personal data is kept in identifiable form no longer than necessary for the stated purpose.",
    "control_description": "Retention schedules are defined per data category and system, approved by Legal, and enforced through automated purge or anonymization jobs with exception reporting.",
    "risk_addressed": "Personal data retained beyond business or statutory need, expanding breach blast radius and creating storage-limitation findings.",
    "inherent_risk": "High",
    "key_control": true,
    "control_type": "Detective",
    "control_nature": "Automated",
    "frequency": "Quarterly",
    "test_of_design": "Inspect the retention schedule and confirm periods are defined per data category, mapped to systems, and approved by Legal within the last 12 months.",
    "test_of_effectiveness": "For sampled systems, re-perform a query for records exceeding the defined retention period and agree purge job execution logs to the schedule.",
    "population_basis": "All production systems in the data inventory flagged as holding personal data.",
    "sampling_basis": "Quarterly automated control: sample 2 quarters per in-scope system; minimum 5 systems selected by data volume and sensitivity.",
    "evidence_required": "Approved retention schedule, purge job configuration export, deletion/anonymization logs, exception reports.",
    "itgc_dependency": [
      "Job Scheduling",
      "Change Management"
    ],
    "cross_framework_refs": [
      "DPDP-Sec8.7",
      "ISO27701-A.7.4.5",
      "SOC2-P4.2"
    ],
    "owner": "Data Protection Officer",
    "framework": "GDPR",
    "status": "Not Started",
    "residual_risk": null,
    "test_result": "Not Tested",
    "exceptions_noted": null,
    "conclusion": null,
    "gap_notes": null,
    "period_covered": null,
    "prepared_by": null,
    "reviewed_by": null,
    "last_reviewed": null
  },
  {
    "id": "GDPR-Art6",
    "clause_ref": "Article 6",
    "domain": "Consent & Lawful Basis",
    "control_objective": "Ensure every processing activity has a documented and valid lawful basis before processing begins.",
    "control_description": "A lawful basis assessment is completed and approved as part of the intake process for any new or materially changed processing activity, and recorded against the RoPA entry.",
    "risk_addressed": "Processing personal data without a valid lawful basis, exposing the organization to enforcement action and invalidating downstream processing.",
    "inherent_risk": "High",
    "key_control": true,
    "control_type": "Preventive",
    "control_nature": "IT-Dependent Manual",
    "frequency": "Event-driven",
    "test_of_design": "Inspect the processing intake workflow and confirm lawful basis assessment is a mandatory, non-bypassable gate prior to go-live approval.",
    "test_of_effectiveness": "Select processing activities initiated in the period and trace each to an approved lawful basis assessment dated prior to first processing.",
    "population_basis": "All processing activities added or materially changed during the audit period, per RoPA change log.",
    "sampling_basis": "Event-driven key control: 25 items, or full population if fewer than 25.",
    "evidence_required": "RoPA extract with change log, lawful basis assessment forms with approval evidence, intake workflow configuration.",
    "itgc_dependency": [
      "Logical Access"
    ],
    "cross_framework_refs": [
      "DPDP-Sec4",
      "ISO27701-A.7.2.2",
      "NISTPF-GV.PO-P1"
    ],
    "owner": "Data Protection Officer",
    "framework": "GDPR",
    "status": "Not Started",
    "residual_risk": null,
    "test_result": "Not Tested",
    "exceptions_noted": null,
    "conclusion": null,
    "gap_notes": null,
    "period_covered": null,
    "prepared_by": null,
    "reviewed_by": null,
    "last_reviewed": null
  },
  {
    "id": "GDPR-Art7",
    "clause_ref": "Article 7",
    "domain": "Consent & Lawful Basis",
    "control_objective": "Ensure consent is freely given, specific, informed, unambiguous, and as easy to withdraw as to give.",
    "control_description": "A consent management platform captures granular consent with timestamp, version of notice shown, and capture mechanism; withdrawal requests propagate to downstream systems within a defined SLA.",
    "risk_addressed": "Reliance on invalid or unprovable consent, and continued processing after withdrawal.",
    "inherent_risk": "High",
    "key_control": true,
    "control_type": "Preventive",
    "control_nature": "Automated",
    "frequency": "Continuous",
    "test_of_design": "Review CMP configuration for granularity, absence of pre-ticked boxes, and the downstream propagation design for withdrawals.",
    "test_of_effectiveness": "Sample consent records and agree to notice version served; separately sample withdrawal events and confirm downstream suppression within SLA.",
    "population_basis": "All consent capture and withdrawal events logged by the CMP during the audit period.",
    "sampling_basis": "Continuous automated control: 25 consent captures and 25 withdrawals, selected randomly across the period.",
    "evidence_required": "CMP consent log extract, notice version history, downstream suppression logs, CMP configuration screenshots.",
    "itgc_dependency": [
      "Change Management",
      "Interface Controls"
    ],
    "cross_framework_refs": [
      "DPDP-Sec6",
      "ISO27701-A.7.2.4",
      "SOC2-P2.1"
    ],
    "owner": "Marketing Operations / DPO",
    "framework": "GDPR",
    "status": "Not Started",
    "residual_risk": null,
    "test_result": "Not Tested",
    "exceptions_noted": null,
    "conclusion": null,
    "gap_notes": null,
    "period_covered": null,
    "prepared_by": null,
    "reviewed_by": null,
    "last_reviewed": null
  },
  {
    "id": "GDPR-Art12-23",
    "clause_ref": "Articles 12-23",
    "domain": "Data Subject Rights",
    "control_objective": "Ensure data subject requests are fulfilled completely and within the one-month statutory deadline.",
    "control_description": "DSARs are logged in a case management tool with identity verification, system-by-system search coverage, and SLA tracking with escalation at defined thresholds.",
    "risk_addressed": "Failure to respond within statutory timelines or incomplete responses omitting data held in secondary systems.",
    "inherent_risk": "High",
    "key_control": true,
    "control_type": "Preventive",
    "control_nature": "IT-Dependent Manual",
    "frequency": "Event-driven",
    "test_of_design": "Review the DSAR SOP for SLA definitions, identity verification steps, escalation path, and the system coverage checklist used for searches.",
    "test_of_effectiveness": "Sample closed DSARs; recompute elapsed days from receipt to response, inspect identity verification evidence, and confirm all in-scope systems on the coverage checklist were searched.",
    "population_basis": "All DSARs received during the audit period per the case management tool, reconciled to the privacy inbox.",
    "sampling_basis": "Event-driven key control: 25 requests, or full population if fewer than 25. Include all requests that breached SLA.",
    "evidence_required": "DSAR ticket export with timestamps, identity verification records, system search coverage checklists, response packs.",
    "itgc_dependency": [
      "Logical Access"
    ],
    "cross_framework_refs": [
      "DPDP-Sec11",
      "ISO27701-A.7.3.6",
      "SOC2-P5.1"
    ],
    "owner": "Privacy Operations Team",
    "framework": "GDPR",
    "status": "Not Started",
    "residual_risk": null,
    "test_result": "Not Tested",
    "exceptions_noted": null,
    "conclusion": null,
    "gap_notes": null,
    "period_covered": null,
    "prepared_by": null,
    "reviewed_by": null,
    "last_reviewed": null
  },
  {
    "id": "GDPR-Art13-14",
    "clause_ref": "Articles 13-14",
    "domain": "Notice & Transparency",
    "control_objective": "Ensure data subjects receive complete and accurate privacy information at the point of collection.",
    "control_description": "Privacy notices are version-controlled, reviewed at least annually and on material processing change, and reconciled against the RoPA to confirm all purposes and recipients are disclosed.",
    "risk_addressed": "Privacy notice diverging from actual processing, resulting in transparency findings and invalid consent.",
    "inherent_risk": "Medium",
    "key_control": true,
    "control_type": "Detective",
    "control_nature": "Manual",
    "frequency": "Annual",
    "test_of_design": "Inspect the notice review procedure and confirm it requires reconciliation to the RoPA and sign-off by Legal or the DPO.",
    "test_of_effectiveness": "Agree the current published notice to the RoPA for purposes, recipients, retention and transfer disclosures; inspect evidence of the most recent review sign-off.",
    "population_basis": "All externally published privacy notices across web properties, apps, and collection forms.",
    "sampling_basis": "Annual control: test the full population of published notices where fewer than 10; otherwise sample 5 by traffic volume.",
    "evidence_required": "Published notice versions, version history, RoPA reconciliation working paper, review sign-off.",
    "itgc_dependency": [
      "Change Management"
    ],
    "cross_framework_refs": [
      "DPDP-Sec5",
      "ISO27701-A.7.3.2",
      "NISTPF-CM.AW-P1",
      "SOC2-P1.1"
    ],
    "owner": "Legal / DPO",
    "framework": "GDPR",
    "status": "Not Started",
    "residual_risk": null,
    "test_result": "Not Tested",
    "exceptions_noted": null,
    "conclusion": null,
    "gap_notes": null,
    "period_covered": null,
    "prepared_by": null,
    "reviewed_by": null,
    "last_reviewed": null
  },
  {
    "id": "GDPR-Art22",
    "clause_ref": "Article 22",